{
  "schema_version": 1,
  "world_id": "ember_foundry",
  "dot_name": "Ember",
  "concept": "Ember's Ember Foundry",
  "owner_locked": {
    "constraints": {
      "privacy": "private",
      "max_zones": 6,
      "max_objects": 24,
      "max_span": 60,
      "must_haves": [
        "No paid generation; preserve the meaningful object."
      ],
      "veto_tags": [],
      "accessibility": [
        "desktop_keyboard"
      ],
      "protected_objects": [
        "keepsake"
      ]
    },
    "entity_protection": [
      {
        "kind": "object",
        "id": "keepsake",
        "fields": [
          "*"
        ],
        "chosen_by": "dot",
        "reason": "A stable personal marker that survives later expansions."
      }
    ],
    "privacy": "private deployment required"
  },
  "dot_choice": {
    "setting": {
      "value": "Ember's Ember Foundry",
      "chosen_by": "dot",
      "reason": "Independent synthetic Dot choice for this specimen."
    },
    "mood": {
      "value": "Industrial flow from making through assembly to useful records.",
      "chosen_by": "dot",
      "reason": "Activities determine the physical plan."
    },
    "topology": {
      "value": "linear",
      "chosen_by": "dot",
      "reason": "Separate chosen activities through a distinct usable spatial relationship."
    }
  },
  "shared_decision": {
    "decisions": [
      {
        "value": "Use supported animation poses and keep the first world private.",
        "chosen_by": "collaborative",
        "reason": "Honest capabilities and owner privacy belong in this synthetic brief."
      }
    ]
  },
  "capabilities": {
    "interactions": "navigate_face_and_animate",
    "contact": "not_implemented",
    "real_activity": "unavailable",
    "limitations": [
      "Open pavilion grammar; no arbitrary buildings or enclosed door solver.",
      "Activity poses are simulated; no IK, physical hand contact, seat fit or actual work is claimed.",
      "Owner must_haves and unsupported wishes are retained prose, not automatically proven requirements.",
      "Private is a deployment requirement, not access control implemented by world JSON.",
      "Engine, browser, accessibility and hosting acceptance are separate from static compilation."
    ]
  },
  "initial_scope": [
    "Forge supports tinker",
    "Assembly supports work",
    "Archive supports inspect"
  ],
  "expansion_history": []
}
